### ISSUE TITLE
statsN result contain dot at the end of metrics

### ISSUE THREAD

**Issue by keyboardfann** [TryStatsN/StatsN#6]
Hi, 
     I install statsN from Nuget and use it for test. But  the result seems not the standard statsd format. The result contain '.' at the end of metrics. Do anyone know what happen?

Code:
```
using System;
using StatsN;
using System.Threading;
namespace ConsoleApp2
{
    class Program
    {
        static void Main(string[] args)
        {
            var host = "192.168.100.100";
            var port = 12000;
            StatsN.IStatsd client = Statsd.New<Udp>(new StatsN.StatsdOptions() { HostOrIp = host, Port = port });
            var name = "fanntest.statsn.test";

            while (true)
            {
                client.Count(name, 1);
                Console.WriteLine(name + " : " + DateTime.UtcNow);
                Thread.Sleep(3000);
            }
        }
    }
}

```

Result:
Use ngrep to verify
```
[root@vip1 ~]# ngrep -W byline -d eth1 port 12000 -t 
interface: eth1 (192.168.100.0/255.255.255.0)
filter: ( port 12000 ) and ((ip || ip6) || (vlan && (ip || ip6)))
#
U 2018/04/19 02:17:55.246737 192.168.100.1:62538 -> 192.168.100.100:12000
fanntest.statsn.test:1|c.

#
U 2018/04/19 02:17:58.252027 192.168.100.1:62538 -> 192.168.100.100:12000
fanntest.statsn.test:1|c.

#
U 2018/04/19 02:18:01.252501 192.168.100.1:62538 -> 192.168.100.100:12000
fanntest.statsn.test:1|c.

#
U 2018/04/19 02:18:06.356579 192.168.100.1:62538 -> 192.168.100.100:12000
fanntest.statsn.test:1|c.

```

use tcpdump to verity
```
[root@vip1 ~]#  tcpdump -i eth1 -u -nn port 12000 -A
tcpdump: verbose output suppressed, use -v or -vv for full protocol decode
listening on eth1, link-type EN10MB (Ethernet), capture size 262144 bytes
12:39:21.209539 IP 192.168.100.1.55555 > 192.168.100.100.12000: UDP, length 26
E..6H;........d...dd.....".vfanntest.statsn.test:1|c

12:39:24.464836 IP 192.168.100.1.55555 > 192.168.100.100.12000: UDP, length 26
E..6H=........d...dd.....".vfanntest.statsn.test:1|c

12:39:27.715780 IP 192.168.100.1.55555 > 192.168.100.100.12000: UDP, length 26
E..6H?........d...dd.....".vfanntest.statsn.test:1|c

12:39:30.967056 IP 192.168.100.1.55555 > 192.168.100.100.12000: UDP, length 26
E..6HA........d...dd.....".vfanntest.statsn.test:1|c

```

Test statsd.net  C# client
https://github.com/lukevenediger/statsd-csharp-client

Test code:
```
using System;
using StatsdClient;
using System.Threading;
namespace ConsoleApp1
{
    class Program
    {
        static void Main(string[] args)
        {
            while (true)
            {
                var statsd = new Statsd("192.168.100.100", 12000);
                statsd.LogCount("fanntest.statsdnet.test");
                Thread.Sleep(3000);
            }
        }
    }
}

```

ngrep result:
```
[root@vip1 ~]#   ngrep -W byline -d eth1 port 12000 -t
interface: eth1 (192.168.100.0/255.255.255.0)
filter: ( port 12000 ) and ((ip || ip6) || (vlan && (ip || ip6)))
#
U 2018/04/19 12:43:15.649114 192.168.100.1:53640 -> 192.168.100.100:12000
fanntest.statsdnet.test:1|c
#
U 2018/04/19 12:43:18.900465 192.168.100.1:53641 -> 192.168.100.100:12000
fanntest.statsdnet.test:1|c
#
U 2018/04/19 12:43:22.151633 192.168.100.1:53643 -> 192.168.100.100:12000
fanntest.statsdnet.test:1|c
#
U 2018/04/19 12:43:25.402575 192.168.100.1:53645 -> 192.168.100.100:12000
fanntest.statsdnet.test:1|c

```

tcpdump result:
```
[root@vip1 ~]#  tcpdump -i eth1 -u -nn port 12000 -A
tcpdump: verbose output suppressed, use -v or -vv for full protocol decode
listening on eth1, link-type EN10MB (Ethernet), capture size 262144 bytes


12:44:06.256404 IP 192.168.100.1.63856 > 192.168.100.100.12000: UDP, length 27
E..7MB........d...dd.p...#S-fanntest.statsdnet.test:1|c
12:44:09.508532 IP 192.168.100.1.63857 > 192.168.100.100.12000: UDP, length 27
E..7MD........d...dd.q...#S,fanntest.statsdnet.test:1|c
12:44:12.759845 IP 192.168.100.1.63858 > 192.168.100.100.12000: UDP, length 27
E..7MG........d...dd.r...#S+fanntest.statsdnet.test:1|c
12:44:16.012130 IP 192.168.100.1.63859 > 192.168.100.100.12000: UDP, length 27
E..7MI........d...dd.s...#S*fanntest.statsdnet.test:1|c

```

**Comment by TerribleDev** [comment]
Hey,

that's pretty strange behavior! We've been using this library for 2ish years at vistaprint. We've never seen this before, not saying its not possible.

I'm currently on holiday at the moment. I'll be back late next week. I'm going to spend some time updating this to the new csproj, and I'll dig into why something like that could happen. Thanks for the repro steps and log!

**Comment by keyboardfann** [comment]
Hi @TerribleDev ,
    Thank you for the reply, I use tcpdump to get statsN result and the result looks good.  It's very wierd why use ngrep to get statsN result will have the issue.
    I also attach the statsd.net C# client testing result for your reference, statsd.net C# client use ngrep and tcpdump to get the result and looks normal.

**Comment by sanjaiganesh** [comment]
I would guess that is NewLine character  that the library appends.. just shown as '.'. 
I had filed #9  for the same.
